<?xml version="1.0" encoding="UTF-8"?>
<perustiedot xmlns:p="http://service.koodisto.sade.vm.fi/types/koodisto"
             xmlns:xsi="http://www.w3.org/2001/XMLSchema-instance"
             xsi:noNamespaceSchemaLocation="perusaste-henkilot.xsd">
    <eranTunniste>eranTunniste 67</eranTunniste>
    <henkilot>
        <henkilo>
            <hetu>131094-XXXX</hetu>
            <lahtokoulu>05127</lahtokoulu>
            <luokka>9A</luokka>
            <sukunimi>Åädas</sukunimi>
            <etunimet>Juha Jaakko</etunimet>
            <kutsumanimi>Jaakko</kutsumanimi>
            <kotikunta>020</kotikunta>
            <aidinkieli>FI</aidinkieli>
            <kansalaisuus>246</kansalaisuus>
            <lahiosoite>Katu 1 A 1</lahiosoite>
            <postinumero>00100</postinumero>
            <matkapuhelin>040 1234 567</matkapuhelin>
            <muuPuhelin>09 1234 567</muuPuhelin>
            <perusopetus>
                <valmistuminen>2017-06-03</valmistuminen>
                <myontaja>05127</myontaja>
                <suorituskieli>FI</suorituskieli>
                <tila>KESKEN</tila>
                <yksilollistaminen>ALUEITTAIN</yksilollistaminen>
            </perusopetus>
        </henkilo>
        <henkilo>
            <hetu>131094-YYYY</hetu>
            <lahtokoulu>05127</lahtokoulu>
            <luokka>9A</luokka>
            <sukunimi>Åädas</sukunimi>
            <etunimet>Juha Jaakko</etunimet>
            <kutsumanimi>Jaakko</kutsumanimi>
            <kotikunta>020</kotikunta>
            <aidinkieli>FI</aidinkieli>
            <kansalaisuus>246</kansalaisuus>
            <lahiosoite>Katu 1 A 1</lahiosoite>
            <postinumero>00100</postinumero>
            <matkapuhelin>040 1234 567</matkapuhelin>
            <muuPuhelin>09 1234 567</muuPuhelin>
            <valma>
                <valmistuminen>2017-06-03</valmistuminen>
                <myontaja>05127</myontaja>
                <suorituskieli>FI</suorituskieli>
                <tila>KESKEN</tila>
            </valma>
        </henkilo>
        <henkilo>
            <henkiloTunniste>TUNNISTE</henkiloTunniste>
            <syntymaAika>1999-03-32</syntymaAika>
            <sukupuoli>1</sukupuoli>
            <lahtokoulu>05127</lahtokoulu>
            <luokka>9A</luokka>
            <sukunimi>Testinen</sukunimi>
            <etunimet>Pete Jaakko</etunimet>
            <kutsumanimi>Jaakko</kutsumanimi>
            <kotikunta>020</kotikunta>
            <aidinkieli>FI</aidinkieli>
            <kansalaisuus>246</kansalaisuus>
            <lahiosoite>Katu 1 A 1</lahiosoite>
            <postinumero>00100</postinumero>
            <matkapuhelin>040 1234 567</matkapuhelin>
            <muuPuhelin>09 1234 567</muuPuhelin>
            <ulkomainen>
                <valmistuminen>2015-06-03</valmistuminen>
                <myontaja>05127</myontaja>
                <suorituskieli>FI</suorituskieli>
                <tila>KESKEN</tila>
            </ulkomainen>
            <maahanmuuttajienammvalmistava>
                <valmistuminen>2016-06-03</valmistuminen>
                <myontaja>05127</myontaja>
                <suorituskieli>FI</suorituskieli>
                <tila>VALMIS</tila>
            </maahanmuuttajienammvalmistava>
            <valma>
                <valmistuminen>2017-06-03</valmistuminen>
                <myontaja>05127</myontaja>
                <suorituskieli>FI</suorituskieli>
                <tila>KESKEN</tila>
            </valma>
        </henkilo>
        <henkilo>
            <oppijanumero>1.2.246.562.24.esimerkki</oppijanumero>
            <lahtokoulu>05127</lahtokoulu>
            <luokka>9A</luokka>
            <sukunimi>Testinen</sukunimi>
            <etunimet>Mika Jaakko</etunimet>
            <kutsumanimi>Jaakko</kutsumanimi>
            <kotikunta>020</kotikunta>
            <aidinkieli>FI</aidinkieli>
            <kansalaisuus>246</kansalaisuus>
            <lahiosoite>Katu 1 A 1</lahiosoite>
            <postinumero>00100</postinumero>
            <matkapuhelin>040 1234 567</matkapuhelin>
            <muuPuhelin>09 1234 567</muuPuhelin>
            <perusopetus>
                <valmistuminen>2016-06-03</valmistuminen>
                <myontaja>05127</myontaja>
                <suorituskieli>FI</suorituskieli>
                <tila>VALMIS</tila>
                <yksilollistaminen>EI</yksilollistaminen>
            </perusopetus>
            <perusopetuksenlisaopetus>
                <valmistuminen>2017-06-03</valmistuminen>
                <myontaja>05127</myontaja>
                <suorituskieli>FI</suorituskieli>
                <tila>KESKEN</tila>
                <yksilollistaminen>EI</yksilollistaminen>
            </perusopetuksenlisaopetus>
        </henkilo>
    </henkilot>
</perustiedot>
